ASA,ASE,Variable,Description
True,True,[ServerSettings],"Les options suivantes doivent figurer dans la section [ServerSettings] de GameUserSettings.ini :"
True,True,ActiveMods,"Type de valeur : liste des ID de mod, séparés par des virgules sans espaces, sur une seule ligne (par exemple : ModID1,ModID2,ModID3) Spécifie l'ordre et quels mods sont chargés. Les ModID sont séparés par des virgules et sur une seule ligne. La priorité est par ordre décroissant (le ModID le plus à gauche a la priorité la plus élevée). Alternativement, mais non suggéré, la ligne de commande ?GameModIds= peut être utilisée."
True,None,ActiveMapMod,"Type de valeur : ID de mod pour la carte de mod actuellement active. Spécifie quelle carte de mod est chargée.?"
False,True,ActiveTotalConversion,"Type de valeur : ModID Utilisé pour spécifier un mod de conversion total (ex : Primitive Plus). Alternativement, l'option de ligne de commande -TotalConversionMod=<ModID> peut également être définie."
True,True,AdminLogging,"Valeur par défaut : False Type de valeur : booléen Si True, enregistre toutes les commandes d'administrateur dans le chat en jeu."
True,True,AllowAnyoneBabyImprintCuddle,"Valeur par défaut : False Type de valeur : booléen Si True, permet à quiconque de « prendre soin » d'un bébé créature (câlin, etc.), pas seulement à la personne qui y a imprimé."
True,True,AllowCaveBuildingPvE,"Valeur par défaut : False Type de valeur : booléen Si True, autorise la construction dans des grottes lorsque le mode PvE est également activé. Remarque : plus besoin de travailler dans les options de ligne de commande avant le patch 241.5."
True,True,AllowCaveBuildingPvP,"Valeur par défaut : True Type de valeur : booléen Si False, empêche la construction de grottes lorsque le mode PvP est également activé."
None,True,AllowCrateSpawnsOnTopOfStructures,"Valeur par défaut : False Type de valeur : booléen Si vrai, permet aux caisses de ravitaillement aériennes d'apparaître au-dessus des structures, plutôt que d'être empêchées par les structures."
True,True,AllowFlyerCarryPvE,"Valeur par défaut : False Type de valeur : booléen Si vrai, permet aux créatures volantes de ramasser des créatures sauvages en PvE."
None,True,AllowFlyingStaminaRecovery,"Valeur par défaut : False Type de valeur : booléen Si True, permet au serveur de récupérer de l'endurance lorsqu'il se tient sur un Flyer."
True,True,AllowHideDamageSourceFromLogs,"Valeur par défaut : True Type de valeur : booléen Si False, affiche les sources de dégâts dans les journaux de tribu."
True,True,AllowHitMarkers,"Valeur par défaut : True Type de valeur : booléen Si False, désactive les marqueurs facultatifs pour les attaques à distance."
None,True,AllowIntegratedSPlusStructures,"Valeur par défaut : True Type de valeur : booléen si False, désactive toutes les nouvelles structures S+ (destiné principalement à permettre aux serveurs non officiels qui souhaitent continuer à utiliser la version mod S+ de continuer à l'utiliser sans une tonne de structures en double supplémentaires)."
True,True,AllowMultipleAttachedC4,"Valeur par défaut : False Type de valeur : booléen Si True, permet d'attacher plus d'un C4 par créature."
True,True,AllowRaidDinoFeeding,"Valeur par défaut : False Type de valeur : booléen Si True, permet d'apprivoiser les Titanosaures de manière permanente (c'est-à-dire de leur permettre d'être nourris). Remarque : dans The Island, seul un maximum de 3 Titanosaures apparaît, donc 3 Titanosaures apprivoisés devraient finalement empêcher d'autres de se reproduire."
None,True,AllowSharedConnections,"Valeur par défaut : False Type de valeur : booléen Si True, permet aux joueurs du partage familial de se connecter au serveur."
None,True,AllowTekSuitPowersInGenesis,"Valeur par défaut : False Type de valeur : booléen Si True, active les pouvoirs de la combinaison TEK dans Genesis : Partie 1."
True,True,AllowThirdPersonPlayer,"Valeur par défaut : True Type de valeur : booléen Si False, désactive la caméra tierce autorisée par défaut sur tous les serveurs dédiés."
True,True,AlwaysAllowStructurePickup,"Valeur par défaut : False Type de valeur : booléen Si True désactive la minuterie sur le système de prise en charge rapide."
None,True,AlwaysNotifyPlayerLeft,"Valeur par défaut : False Type de valeur : booléen Si True, les joueurs seront toujours avertis si quelqu'un quitte le serveur"
None,True,AutoDestroyDecayedDinos,"Valeur par défaut : False Type de valeur : booléen Si True, détruit automatiquement les animaux pourris récupérables au chargement, plutôt que de les laisser comme récupérables. Remarque : après le patch 273.691, en mode PvE, la récupération automatique après la période de dégradation a été désactivée en PvE officiel."
None,True,AutoDestroyOldStructuresMultiplier,"Valeur par défaut : 0,0 Type de valeur : float Autorise l'autodestruction des structures uniquement après qu'un délai suffisant « sans tribu à proximité » se soit écoulé (défini comme un multiplicateur de la période d'autorisation de réclamation). Pour l'activer, définissez-le sur 1.0. Utile pour les serveurs pour éliminer automatiquement les structures abandonnées au fil du temps. Nécessite l’option de ligne de commande -AutoDestroyStructures pour fonctionner. La valeur évolue avec le temps de décroissance de chaque structure."
True,True,AutoSavePeriodMinutes,"Valeur par défaut : 15,0 Type de valeur : float Définit l'intervalle pour les sauvegardes automatiques. Le définir sur 0 entraînera une sauvegarde constante."
None,True,BanListURL,"Type de valeur : chaîne avec une URL Définit la liste des interdictions globales. Doit être placé entre guillemets doubles. La liste d'interdiction officielle est http://arkdedicated.com/banlist.txt, avant 279.233, l'URL était http://playark.com/banlist.txt. Remarque : il prend uniquement en charge le protocole HTTP (HTTPS n'est pas pris en charge)."
None,True,bForceCanRideFliers,"Type de valeur : booléen Si True, permet d'utiliser les flyers sur les cartes où ils sont normalement désactivés. Remarque : si vous le définissez sur False, les dépliants seront désactivés sur n'importe quelle carte."
True,True,ClampItemSpoilingTimes,"Valeur par défaut : False Type de valeur : booléen Si True, limite tous les temps d'altération aux temps d'altération maximum des éléments. Utile si des exploits infinis ont été utilisés sur le serveur et que vous souhaitez les nettoyer. Cela pourrait potentiellement causer des problèmes avec les mods qui modifient le temps de détérioration, c'est donc une option."
None,True,ClampItemStats,"Valeur par défaut : False Type de valeur : booléen Si True, active le blocage des statistiques pour les éléments. Voir ItemStatClamps pour plus d'informations."
True,True,ClampResourceHarvestDamage,"Valeur par défaut : False Type de valeur : booléen Si True, limite les dégâts causés par un apprivoisé à une ressource lors de la récolte en fonction de la santé restante de la ressource. Remarque : l'activation de ce paramètre peut entraîner une réduction sensible de la récolte de ressources à l'aide d'outils ou de créatures à dégâts élevés."
None,True,CustomDynamicConfigUrl,"Type de valeur : chaîne avec une URL Lien direct vers un fichier Dynamicconfig.ini en direct (http://arkdedicated.com/dynamicconfig.ini), permettant des modifications en direct des options prises en charge sans avoir besoin de redémarrer le serveur, ainsi que la définition d'un jeu de couleurs personnalisé pour les apparitions de créatures sauvages. Remarque : nécessite l'option de ligne de commande -UseDynamicConfig, la chaîne avec une URL doit utiliser le protocole HTTP (HTTPS n'est pas pris en charge) et des guillemets intérieurs si elle est utilisée dans la ligne de commande. Consultez la section DynamicConfig pour connaître les paramètres pris en charge."
None,True,CustomLiveTuningUrl,"Type de valeur : chaîne avec une URL Lien direct vers le fichier de réglage en direct (par exemple : http://arkdedicated.com/DefaultOverloads.json). Actuellement, permet uniquement de modifier les valeurs de DecayDestructionPeriod et DecayDestructionPeriodMultiplier pour n'importe quelle structure du jeu. Remarque : la chaîne avec une URL doit utiliser le protocole HTTP (HTTPS n'est pas pris en charge) et des guillemets intérieurs si elle est utilisée en ligne de commande. Pour plus d'informations sur l'utilisation de ce système, consultez l'annonce officielle : https://survivetheark.com/index.php?/forums/topic/569366-server-configuration-live-tuning-system."
True,True,DayCycleSpeedScale,"Valeur par défaut : 1.0 Type de valeur : float Spécifie le facteur d'échelle pour le passage du temps dans l'ARK, contrôlant la fréquence à laquelle le jour passe à la nuit et la nuit à jour. La valeur par défaut 1 offre la même vitesse de cycle que l'expérience solo (et les serveurs publics officiels). Les valeurs inférieures à 1 ralentissent le cycle ; des valeurs plus élevées l’accélèrent. Le temps de base lorsque la valeur est 1 semble être de 1 minute en temps réel, soit environ 1 minute. Temps de jeu de 28 minutes. Ainsi, pour un cycle jour/nuit d’environ 24 heures dans le jeu, utilisez 0,035 pour la valeur."
True,True,DayTimeSpeedScale,"Valeur par défaut : 1,0 Type de valeur : float Spécifie le facteur d'échelle pour le passage du temps dans l'ARK pendant la journée. Cette valeur détermine la durée de chaque jour, par rapport à la durée de chaque nuit (telle que spécifiée par NightTimeSpeedScale). Réduire cette valeur augmente la durée de chaque journée."
True,False,DestroyTamesOverTheSoftTameLimit,"Valeur par défaut : false Type de valeur : booléen permet de détruire les apprivoisés au-delà de la limite"
False,True,DestroyUnconnectedWaterPipes,"Valeur par défaut : False Type de valeur : booléen Si vrai, après deux jours en temps réel, les tuyaux se détruiront automatiquement s'ils ne sont pas connectés à un non-tuyau (directement ou indirectement) et qu'aucun joueur allié n'est à proximité."
True,True,DifficultyOffset,"Valeur par défaut : 1,0 Type de valeur : float Spécifie le niveau de difficulté."
True,True,DinoCharacterFoodDrainMultiplier,"Valeur par défaut : 1.0 Type de valeur : float Spécifie le facteur d'échelle pour la consommation alimentaire des créatures. Des valeurs plus élevées augmentent la consommation de nourriture (les créatures ont faim plus rapidement). Cela affecte également les temps d'apprivoisement."
True,True,DinoCharacterHealthRecoveryMultiplier,"Valeur par défaut : 1.0 Type de valeur : float Spécifie le facteur d'échelle pour la récupération de santé des créatures. Des valeurs plus élevées augmentent le taux de récupération (les créatures guérissent plus rapidement)."
True,True,DinoCharacterStaminaDrainMultiplier,"Valeur par défaut : 1.0 Type de valeur : float Spécifie le facteur d'échelle pour la consommation d'endurance des créatures. Des valeurs plus élevées augmentent la consommation d'endurance (les créatures se fatiguent plus rapidement)."
None,True,DinoCountMultiplier,"Valeur par défaut : 1.0 Type de valeur : float Spécifie le facteur d'échelle pour les apparitions de créatures. Des valeurs plus élevées augmentent le nombre de créatures apparaissant dans l’ARK."
True,True,DinoDamageMultiplier,"Valeur par défaut : 1,0 Type de valeur : float Spécifie le facteur d'échelle pour les dégâts que les créatures sauvages infligent avec leurs attaques. La valeur par défaut 1 fournit des dégâts normaux. Des valeurs plus élevées augmentent les dégâts. Des valeurs inférieures le diminuent."
True,True,DinoResistanceMultiplier,"Valeur par défaut : 1,0 Type de valeur : float Spécifie le facteur d'échelle pour la résistance aux dégâts que les créatures sauvages reçoivent lorsqu'elles sont attaquées. La valeur par défaut 1 fournit des dégâts normaux. Des valeurs plus élevées diminuent la résistance, augmentant les dégâts par attaque. Des valeurs inférieures l’augmentent, réduisant ainsi les dégâts par attaque. Une valeur de 0,5 entraînerait une créature subissant la moitié des dégâts tandis qu'une valeur de 2,0 entraînerait une créature subissant le double des dégâts normaux."
True,True,DisableDinoDecayPvE,"Valeur par défaut : False Type de valeur : booléen Si vrai, désactive la dégradation des créatures en mode PvE. Remarque : après le patch 273.691, en mode PvE, la récupération automatique de la créature après une période de décomposition a été désactivée."
True,True,DisableImprintDinoBuff,"Valeur par défaut : False Type de valeur : booléen Si vrai, désactive le bonus de statistique du joueur qui imprègne la créature. Lorsque celui qui s'est spécifiquement imprimé sur la créature et l'a élevé pour avoir une qualité d'impression, obtient un buff supplémentaire de dégâts/résistance."
True,True,DisablePvEGamma,"Valeur par défaut : False Type de valeur : booléen Si True, empêche l'utilisation de la commande de console « gamma » en mode PvE."
True,True,DisableStructureDecayPvE,"Valeur par défaut : False Type de valeur : booléen Si True, désactive la dégradation automatique progressive des structures des joueurs."
True,True,DisableWeatherFog,"Valeur par défaut : False Type de valeur : booléen Si True, désactive le brouillard."
True,True,DontAlwaysNotifyPlayerJoined,"Valeur par défaut : False Type de valeur : booléen Si True, désactive globalement les notifications de participation des joueurs."
True,True,EnableExtraStructurePreventionVolumes,"Valeur par défaut : False Type de valeur : booléen Si True, désactive la construction dans des zones spécifiques riches en ressources, en particulier la configuration sur l'île autour des principales montagnes."
True,True,EnablePvPGamma,"Valeur par défaut : False Type de valeur : booléen Si True, permet l'utilisation de la commande de console gamma en mode PvP."
None,True,ExtinctionEventTimeInterval,"Type de valeur : secondes Utilisé pour activer le mode d'extinction (ARKpocalypse). Le nombre est le temps en secondes. Utilisez la valeur 2592000 pendant 30 jours."
None,True,FastDecayUnsnappedCoreStructures,"Valeur par défaut : False Type de valeur : booléen Si True, les fondations/piliers/clôtures/stockage dédié Tek non verrouillés se désintégreront après le temps indiqué par FastDecayInterval dans Game.ini (la valeur par défaut est de 12 heures). Avant 259,0, il fixait le temps de désintégration de telles structures à 5 fois plus rapidement."
None,True,ForceAllStructureLocking,"Valeur par défaut : False Type de valeur : booléen Si True, verrouillera par défaut toutes les structures."
True,True,globalVoiceChat,"Valeur par défaut : False Type de valeur : booléen Si True, le chat vocal devient global."
True,True,HarvestAmountMultiplier,"Valeur par défaut : 1,0 Type de valeur : float Spécifie le facteur d'échelle pour les rendements de toutes les activités de récolte (abattage d'arbres, cueillette de baies, sculpture de carcasses, extraction de roches, etc.). Des valeurs plus élevées augmentent la quantité de matériaux récoltés à chaque frappe."
True,True,HarvestHealthMultiplier,"Valeur par défaut : 1.0 Type de valeur : float Spécifie le facteur d'échelle pour la « santé » des éléments pouvant être récoltés (arbres, rochers, carcasses, etc.). Des valeurs plus élevées augmentent la quantité de dégâts (c'est-à-dire le « nombre de coups ») que ces objets peuvent subir avant d'être détruits, ce qui se traduit par des rendements globaux de récolte plus élevés."
None,True,IgnoreLimitMaxStructuresInRangeTypeFlag,"Valeur par défaut : False Type de valeur : booléen Si True, supprime la limite de 150 structures décoratives (drapeaux, panneaux, derme etc.)."
True,True,ItemStackSizeMultiplier,"Valeur par défaut : 1.0 Type de valeur : float Autoriser l'augmentation ou la diminution de la taille globale de la pile d'éléments, cela signifie que toutes les tailles de pile par défaut seront multipliées par la valeur donnée (à l'exclusion des éléments qui ont une taille de pile de 1 par défaut)."
True,True,KickIdlePlayersPeriod,"Valeur par défaut : 3600.0 Type de valeur : float Temps en secondes après lequel les personnages qui n'ont pas bougé ou interagi seront expulsés (si -EnableIdlePlayerKick comme paramètre de ligne de commande est défini). Remarque : bien qu'au niveau du code, il soit défini comme un nombre à virgule flottante, il est suggéré d'utiliser plutôt un nombre entier."
None,True,MaxGateFrameOnSaddles,"Valeur par défaut : 0 Type de valeur : entier Définit le nombre maximum de passerelles autorisées sur les selles de plateforme. Une valeur de 2 empêcherait les joueurs de placer plus de 2 passerelles sur leurs selles de plateforme (utilisées dans les serveurs PvP officiels). Ce paramètre n'est pas rétroactif, ce qui signifie que les versions existantes ne seront pas affectées. Réglé sur 0 pour ne pas permettre aux joueurs de placer des passerelles sur les selles de plateforme (utilisées dans les serveurs PvE officiels)."
None,True,MaxHexagonsPerCharacter,"Valeur par défaut : 2000000000 Type de valeur : entier Définit la quantité maximale d'hexagones qu'un personnage peut accumuler. L'officiel l'a fixé à 2 500 000."
True,True,MaxPersonalTamedDinos,"Valeur par défaut : 0 Type de valeur : entier Définit une limite d'apprivoisement de créatures par tribu (500 sur les serveurs PvE officiels, 300 sur les serveurs PvP officiels). La valeur par défaut de 0 désactive cette limite."
None,True,MaxPlatformSaddleStructureLimit,"Valeur par défaut : 75 Type de valeur : entier Modifie le nombre maximum de créatures/radeaux sur plateforme autorisés sur l'ARK (un coût de performance potentiel). Exemple : MaxPlatformSaddleStructureLimit=10 n'autoriserait que 10 selles/radeaux de plate-forme sur l'ensemble de l'ARK."
True,True,MaxTamedDinos,"Valeur par défaut : 5000,0 Type de valeur : float Définit le nombre maximum de créatures apprivoisées sur un serveur, il s'agit d'un plafond global. Remarque : bien qu'au niveau du code, il soit défini comme un nombre à virgule flottante, il est suggéré d'utiliser plutôt un nombre entier."
True,False,MaxTamedDinos_SoftTameLimit,"Default value: 5000 définir la limite d'apprivoisement logiciel à l'échelle du serveur"
True,False,MaxTamedDinos_SoftTameLimit_CountdownForDeletionDuration "Default value: 604800 réglez la minuterie pour la destruction en secondes"
None,True,MaxTributeCharacters,"Valeur par défaut : 10 Type de valeur : entier Emplacements pour les caractères téléchargés. Toute valeur inférieure à la valeur par défaut sera rétablie. Remarque : son augmentation peut corrompre les données du joueur/du cluster et entraîner la perte de tous les personnages stockés."
True,True,MaxTributeDinos,"Valeur par défaut : 20 Type de valeur : entier Emplacements pour les créatures téléchargées. Toute valeur inférieure à la valeur par défaut sera rétablie. Remarque : Certains joueurs ont revendiqué un maximum de 273 pour être un plafond de sécurité, et un nombre supérieur corromptrait le profil/le cluster et entraînerait la perte de toutes les créatures stockées, mais cela doit être vérifié."
True,True,MaxTributeItems,"Valeur par défaut : 50 Type de valeur : entier Emplacements pour les éléments et ressources téléchargés. Toute valeur inférieure à la valeur par défaut sera rétablie. Remarque : Certains joueurs ont revendiqué un maximum de 154 pour être un plafond de sécurité, et un nombre supérieur corromptrait le profil/cluster et entraînerait la perte de tous les éléments et ressources stockés, mais cela doit être vérifié."
True,True,NightTimeSpeedScale,"Valeur par défaut : 1.0 Type de valeur : float Spécifie le facteur d'échelle pour le passage du temps dans l'ARK pendant la nuit. Cette valeur détermine la durée de chaque nuit, par rapport à la durée de chaque jour (telle que spécifiée par DayTimeSpeedScale). La diminution de cette valeur augmente la durée de chaque nuit."
True,True,NonPermanentDiseases,"Valeur par défaut : False Type de valeur : booléen Si True, rend les maladies permanentes non permanentes. Les joueurs les perdront s’ils réapparaissent."
None,True,NPCNetworkStasisRangeScalePlayerCountStart,"Valeur par défaut : 0 Type de valeur : entier Nombre minimum de joueurs en ligne lorsque le remplacement de l'échelle de plage de stase du réseau NPC est activé (nécessite une saisie dans INI, pas une ligne de commande). Utilisé pour remplacer l'échelle de plage de stase du réseau NPC (afin d'adapter les performances du serveur pour plus de joueurs), la valeur par défaut est 0, ce qui la désactive. Le fonctionnaire l'a fixé à 24."
None,True,NPCNetworkStasisRangeScalePlayerCountEnd,"Valeur par défaut : 0 Type de valeur : entier Nombre maximum de joueurs en ligne lorsque NPCNetworkStasisRangeScalePercentEnd est atteint (nécessite une saisie dans INI, pas dans la ligne de commande). Utilisé pour remplacer l'échelle de plage de stase du réseau NPC (afin d'adapter les performances du serveur pour plus de joueurs), la valeur par défaut est 0, ce qui la désactive. L'officiel l'a réglé à 70"
None,True,NPCNetworkStasisRangeScalePercentEnd,"Valeur par défaut : 0,55000001 Type de valeur : float Le pourcentage d'échelle maximal utilisé lorsque NPCNetworkStasisRangeScalePlayerCountEnd est atteint (nécessite une saisie dans INI, pas dans la ligne de commande). Utilisé pour remplacer l'échelle de plage de stase du réseau NPC (pour faire évoluer les performances du serveur pour plus de joueurs). L'officiel l'a fixé à 0,5."
None,True,OnlyAutoDestroyCoreStructures,"Valeur par défaut : False Type de valeur : booléen Si True, empêche toute structure non centrale/non-fondatrice de s'auto-détruire (cependant, elle sera toujours auto-détruite si un étage sur lequel elle se trouve est auto-détruite). Les serveurs PvE officiels utilisent cette option."
None,True,OnlyDecayUnsnappedCoreStructures,"Valeur par défaut : False Type de valeur : booléen Si True, seules les structures de base non accrochées se désintégreront. Utile pour éliminer le spam des piliers/fondations isolés."
True,True,OverrideOfficialDifficulty,"Valeur par défaut : 0,0 Type de valeur : float Vous permet de remplacer le niveau de difficulté par défaut du serveur de 4 par 5 pour correspondre au nouveau niveau de difficulté officiel du serveur. La valeur par défaut de 0,0 désactive le remplacement. Une valeur de 5,0 permettra aux créatures communes d'apparaître jusqu'au niveau 150. À l'origine (247,95) disponible uniquement en option de ligne de commande."
True,True,OverrideStructurePlatformPrevention,"Valeur par défaut : False Type de valeur : booléen Si True, les tourelles peuvent être construites et fonctionnelles sur les selles de la plate-forme. Puisque 247.999 s'applique également à la structure à pointes. Remarque : malgré les notes de patch, dans ShooterGameServer, il est codé OverrideStructurePlatformPrevention avec deux r."
True,True,OxygenSwimSpeedStatMultiplier,"Valeur par défaut : 1,0 Type de valeur : float Utilisez ceci pour définir la façon dont la vitesse de nage est multipliée par le niveau dépensé en oxygène. La valeur a été réduite de 80 % en 256,0."
True,True,PerPlatformMaxStructuresMultiplier,"Valeur par défaut : 1,0 Type de valeur : float Une valeur plus élevée augmente (à partir d'une échelle de pourcentage) le nombre maximum d'éléments pouvant être placés sur les selles et les radeaux."
None,True,PersonalTamedDinosSaddleStructureCost,"Valeur par défaut : 0 Type de valeur : entier Détermine le nombre d'« emplacements de créature apprivoisée » qu'une selle de plate-forme (avec structures) utilisera pour respecter la limite de créature apprivoisée de la tribu."
True,True,PlatformSaddleBuildAreaBoundsMultiplier,"Valeur par défaut : 1.0 Type de valeur : float Augmenter le nombre permet de placer les structures plus loin de la plateforme."
True,True,PlayerCharacterFoodDrainMultiplier,"Valeur par défaut : 1.0 Type de valeur : float Spécifie le facteur d'échelle pour la consommation alimentaire des personnages joueurs. Des valeurs plus élevées augmentent la consommation de nourriture (les personnages joueurs ont faim plus rapidement)."
True,True,PlayerCharacterHealthRecoveryMultiplier,"Valeur par défaut : 1.0 Type de valeur : float Spécifie le facteur d'échelle pour la récupération de la santé des personnages joueurs. Des valeurs plus élevées augmentent le taux de récupération (les personnages joueurs guérissent plus rapidement)."
True,True,PlayerCharacterStaminaDrainMultiplier,"Valeur par défaut : 1.0 Type de valeur : float Spécifie le facteur d'échelle pour la consommation d'endurance des personnages joueurs. Des valeurs plus élevées augmentent la consommation d’endurance (les personnages joueurs se fatiguent plus rapidement)."
True,True,PlayerCharacterWaterDrainMultiplier,"Valeur par défaut : 1.0 Type de valeur : float Spécifie le facteur d'échelle pour la consommation d'eau des personnages joueurs. Des valeurs plus élevées augmentent la consommation d’eau (les personnages joueurs ont soif plus rapidement)."
True,True,PlayerDamageMultiplier,"Valeur par défaut : 1.0 Type de valeur : float Spécifie le facteur d'échelle pour les dégâts que les joueurs infligent avec leurs attaques. La valeur par défaut 1 fournit des dégâts normaux. Des valeurs plus élevées augmentent les dégâts. Des valeurs inférieures le diminuent."
